{
  "contract_version": "2.1",
  "verification_run_id": "run-001",
  "test_candidates": [
    {
      "candidate_key": "notice-attachment-allowed",
      "export_section_key": "notice",
      "subtopic_id": "subtopic-001",
      "title": "허용 크기 첨부 파일 등록",
      "type": "positive",
      "preconditions": "첨부 가능한 계정으로 작성 화면 접근, 준비한 파일 크기 확인",
      "requirement_links": [
        {
          "requirement_id": "req-attachment",
          "requirement_revision": 3,
          "condition_ids": [
            "cond-size",
            "cond-name",
            "cond-remove"
          ]
        }
      ],
      "steps": [
        {
          "step_key": "attach-allowed",
          "order": 1,
          "action": "크기가 확인된 25MB 파일을 선택한다.",
          "expected": "파일이 첨부되고 파일명이 입력 영역에 표시된다.",
          "test_data": {
            "account": null,
            "input": "25MB 파일 1개",
            "notes": "50MB보다 작은 시험 데이터"
          },
          "requirement_links": [
            {
              "requirement_id": "req-attachment",
              "requirement_revision": 3,
              "condition_ids": [
                "cond-size",
                "cond-name"
              ]
            }
          ]
        },
        {
          "step_key": "attach-remove",
          "order": 2,
          "action": "첨부 입력창의 x 버튼을 클릭한다.",
          "expected": "첨부 파일이 제거된다.",
          "test_data": {
            "account": null,
            "input": "첨부 파일의 x 버튼",
            "notes": ""
          },
          "requirement_links": [
            {
              "requirement_id": "req-attachment",
              "requirement_revision": 3,
              "condition_ids": [
                "cond-remove"
              ]
            }
          ]
        }
      ],
      "prediction": {
        "status": "failure_expected",
        "reason": "설명용 코드 근거에는 10MB 상한이 있어 25MB 입력을 거부할 것으로 예상합니다. 실제 수행 결과는 아닙니다.",
        "verification_run_id": "run-001",
        "primary_chunk_ids": [
          "chunk-010"
        ]
      },
      "assumptions": [
        "시험 계정·파일은 사용자가 준비해야 합니다."
      ],
      "warnings": []
    }
  ],
  "warnings": []
}
